{
  "$schema": "http://json-schema.org/draft-07/schema#",
  "title": "BrandAIReadinessAuditReport",
  "type": "object",
  "required": [
    "site",
    "audited_at",
    "summary",
    "findings"
  ],
  "properties": {
    "site": {
      "type": "string"
    },
    "audited_at": {
      "type": "string",
      "format": "date-time"
    },
    "summary": {
      "type": "object",
      "required": [
        "total_findings",
        "critical",
        "high",
        "medium"
      ],
      "properties": {
        "total_findings": {
          "type": "integer",
          "minimum": 0
        },
        "critical": {
          "type": "integer",
          "minimum": 0
        },
        "high": {
          "type": "integer",
          "minimum": 0
        },
        "medium": {
          "type": "integer",
          "minimum": 0
        },
        "low": {
          "type": "integer",
          "minimum": 0
        }
      }
    },
    "findings": {
      "type": "array",
      "items": {
        "type": "object",
        "required": [
          "id",
          "title",
          "severity",
          "evidence",
          "suggested_action"
        ],
        "properties": {
          "id": {
            "type": "string"
          },
          "title": {
            "type": "string"
          },
          "severity": {
            "type": "string",
            "enum": [
              "critical",
              "high",
              "medium",
              "low"
            ]
          },
          "evidence": {
            "type": "string"
          },
          "suggested_action": {
            "type": "object",
            "required": [
              "summary",
              "priority"
            ],
            "properties": {
              "summary": {
                "type": "string"
              },
              "priority": {
                "type": "string",
                "enum": [
                  "critical",
                  "high",
                  "medium",
                  "low"
                ]
              }
            }
          }
        }
      }
    }
  }
}